{
  "diagnostics": [
    {
      "diagnosticId": "en-esdb-source-scope",
      "message": "ESDB generated default wordlists provide spelling forms by regional profile, not full lexical semantics or inflection metadata.",
      "metadata": {
        "release": "rel-2026.02.25"
      },
      "severity": "info",
      "task": "lexicon.transform"
    }
  ],
  "evaluationRecordIds": [],
  "kind": "quality-profile",
  "languageTag": "en",
  "metrics": [
    {
      "metricId": "profile-count",
      "name": "profileCount",
      "unit": "profiles",
      "value": 5
    },
    {
      "metricId": "total-word-rows",
      "name": "totalWordRows",
      "unit": "rows",
      "value": 548642
    },
    {
      "metricId": "unique-word-count",
      "name": "uniqueWordCount",
      "unit": "words",
      "value": 113681
    },
    {
      "metricId": "records-rejected",
      "name": "recordsRejected",
      "unit": "records",
      "value": 0
    }
  ],
  "profileId": "en-esdb-default-wordlist-quality",
  "schemaVersion": "1",
  "script": "Latn",
  "thresholds": []
}
