{
  "diagnostics": [
    {
      "diagnosticId": "fr-core-source-scope",
      "message": "French core resources are generated from IANA, Unicode, and CLDR snapshots with scope-limited core profile claims.",
      "metadata": {
        "likelySubtag": "fr-Latn-FR",
        "sourceIds": [
          "source:iana:language-subtag-registry",
          "source:unicode:ucd",
          "source:unicode:cldr-core"
        ]
      },
      "severity": "info",
      "task": "core.profile"
    }
  ],
  "evaluationRecordIds": [],
  "kind": "quality-profile",
  "languageTag": "fr",
  "metrics": [
    {
      "metricId": "latin-script-range-count",
      "name": "latinScriptRangeCount",
      "unit": "ranges",
      "value": 61
    },
    {
      "metricId": "punctuation-range-count",
      "name": "punctuationRangeCount",
      "unit": "ranges",
      "value": 396
    },
    {
      "metricId": "records-rejected",
      "name": "recordsRejected",
      "unit": "records",
      "value": 0
    }
  ],
  "profileId": "fr-core-quality",
  "schemaVersion": "1",
  "script": "Latn",
  "thresholds": []
}
