{
  "diagnostics": [
    {
      "diagnosticId": "tatoeba-en-explicit-corpus-artifact-fetch",
      "message": "Tatoeba English sentence data is exposed as an explicit artifact descriptor; local corpus rows have not been materialized yet.",
      "metadata": {
        "artifactId": "artifact:textpack-en-corpus:full:tatoeba-eng-sentences-detailed:2026-06-06",
        "artifactPolicy": "fetch-explicit"
      },
      "severity": "info",
      "task": "corpus.artifact"
    },
    {
      "diagnosticId": "tatoeba-en-attribution-corpus-fields",
      "message": "The pinned detailed sentence export preserves owner and timestamp fields for attribution-aware downstream use.",
      "metadata": {
        "licenseExpression": "CC-BY-2.0-FR"
      },
      "severity": "info",
      "task": "corpus.license"
    }
  ],
  "evaluationRecordIds": [],
  "kind": "quality-profile",
  "languageTag": "en",
  "metrics": [
    {
      "metricId": "sentence-row-count",
      "name": "sentenceRowCount",
      "unit": "rows",
      "value": 2028855
    },
    {
      "metricId": "artifact-size-bytes",
      "name": "artifactSizeBytes",
      "unit": "bytes",
      "value": 34699431
    }
  ],
  "profileId": "tatoeba-en-corpus-artifact-quality",
  "schemaVersion": "1",
  "script": "Latn",
  "thresholds": []
}
