{
  "diagnostics": [
    {
      "diagnosticId": "fr-lexique-383-share-alike-isolation",
      "message": "Lexique 3.83 resources are generated only in an explicit share-alike isolated package.",
      "metadata": {
        "license": "CC-BY-SA-4.0",
        "sourceIds": [
          "source:fr:lexique-383"
        ]
      },
      "severity": "info",
      "task": "license.boundary"
    }
  ],
  "evaluationRecordIds": [],
  "kind": "quality-profile",
  "languageTag": "fr",
  "metrics": [
    {
      "metricId": "entry-count",
      "name": "entryCount",
      "unit": "entries",
      "value": 142694
    },
    {
      "metricId": "lemma-count",
      "name": "lemmaCount",
      "unit": "lemmas",
      "value": 51126
    },
    {
      "metricId": "unique-form-count",
      "name": "uniqueFormCount",
      "unit": "forms",
      "value": 125653
    },
    {
      "metricId": "records-rejected",
      "name": "recordsRejected",
      "unit": "records",
      "value": 0
    }
  ],
  "profileId": "fr-lexique-383-quality",
  "schemaVersion": "1",
  "script": "Latn",
  "thresholds": []
}
