{
  "diagnostics": [
    {
      "diagnosticId": "ar-msa-camel-transform-warnings",
      "message": "CAMeL Morph MSA transform completed without rejected records.",
      "metadata": {
        "warningCount": 0
      },
      "severity": "info",
      "task": "morphology.transform"
    }
  ],
  "evaluationRecordIds": [],
  "kind": "quality-profile",
  "languageTag": "ar",
  "metrics": [
    {
      "metricId": "morpheme-count",
      "name": "morphemeCount",
      "unit": "records",
      "value": 203740
    },
    {
      "metricId": "compatibility-count",
      "name": "compatibilityCount",
      "unit": "records",
      "value": 14823
    },
    {
      "metricId": "records-rejected",
      "name": "recordsRejected",
      "unit": "records",
      "value": 0
    }
  ],
  "profileId": "ar-msa-camel-morphology-quality",
  "schemaVersion": "1",
  "script": "Arab",
  "thresholds": []
}
