{
  "diagnostics": [
    {
      "diagnosticId": "ar-ud-nyuad-raw-text-policy",
      "message": "Generated UD resources exclude FORM and LEMMA text fields.",
      "metadata": {
        "rawTextFieldsEmitted": false
      },
      "severity": "info",
      "task": "syntax.transform"
    }
  ],
  "evaluationRecordIds": [],
  "kind": "quality-profile",
  "languageTag": "ar",
  "metrics": [
    {
      "metricId": "total-token-count",
      "name": "totalTokens",
      "unit": "tokens",
      "value": 738889
    },
    {
      "metricId": "annotation-row-count",
      "name": "annotationRowCount",
      "unit": "records",
      "value": 738889
    },
    {
      "metricId": "dependency-label-by-split-count",
      "name": "dependencyLabelBySplitCount",
      "unit": "labels",
      "value": 76
    }
  ],
  "profileId": "ar-ud-nyuad-quality-profile",
  "schemaVersion": "1",
  "script": "Arab",
  "thresholds": []
}
