{
  "diagnostics": [
    {
      "diagnosticId": "tatoeba-ar-local-corpus-rows",
      "message": "Tatoeba Arabic sentence data is materialized as local canonical TSV rows.",
      "metadata": {
        "artifactId": "artifact:textpack-ar-corpus:full:tatoeba-ara-sentences-detailed:2026-06-06",
        "resourceId": "ar-tatoeba-corpus-sentences",
        "rowChecksum": "sha256:33aa70eab906f119b5b5b8a0accf1a771e8d7ef8dc3d3e60e6b0690e74bf0ae1"
      },
      "severity": "info",
      "task": "corpus.materialization"
    },
    {
      "diagnosticId": "tatoeba-ar-attribution-corpus-fields",
      "message": "The pinned detailed sentence export preserves owner and timestamp fields for attribution-aware downstream use.",
      "metadata": {
        "licenseExpression": "CC-BY-2.0-FR"
      },
      "severity": "info",
      "task": "corpus.license"
    }
  ],
  "evaluationRecordIds": [],
  "kind": "quality-profile",
  "languageTag": "ar",
  "metrics": [
    {
      "metricId": "sentence-row-count",
      "name": "sentenceRowCount",
      "unit": "rows",
      "value": 67974
    },
    {
      "metricId": "rejected-row-count",
      "name": "rejectedRowCount",
      "unit": "rows",
      "value": 0
    }
  ],
  "profileId": "tatoeba-ar-corpus-materialized-quality",
  "schemaVersion": "1",
  "script": "Arab",
  "thresholds": []
}
